{
  "$schema": "https://json-schema.org/draft/2020-12/schema",
  "$id": "https://schemas.mu46.local/v1/build-draft.schema.json",
  "title": "BuildDraft",
  "type": "object",
  "additionalProperties": false,
  "required": [
    "schemaVersion",
    "id",
    "ruleset",
    "dataset",
    "engineVersion",
    "progressionInputs",
    "resetInputs",
    "statDistribution"
  ],
  "properties": {
    "schemaVersion": { "const": "1.3.0" },
    "id": { "$ref": "#/$defs/id" },
    "ruleset": { "$ref": "#/$defs/versionedRef" },
    "dataset": {
      "type": "object",
      "additionalProperties": false,
      "required": ["version", "hash"],
      "properties": {
        "version": { "type": "string", "minLength": 1 },
        "hash": {
          "type": "string",
          "pattern": "^sha256:[0-9a-f]{64}$"
        }
      }
    },
    "engineVersion": { "$ref": "#/$defs/semver" },
    "progressionInputs": {
      "type": "object",
      "additionalProperties": false,
      "required": [
        "characterClassId",
        "evolutionId",
        "level",
        "completedQuestIds"
      ],
      "properties": {
        "characterClassId": { "$ref": "#/$defs/id" },
        "evolutionId": { "$ref": "#/$defs/id" },
        "level": { "type": "integer", "minimum": 1 },
        "completedQuestIds": {
          "type": "array",
          "items": { "$ref": "#/$defs/id" },
          "uniqueItems": true
        }
      }
    },
    "resetInputs": { "$ref": "#/$defs/resetInputs" },
    "equipment": {
      "type": "array",
      "items": { "$ref": "#/$defs/equipmentEntry" }
    },
    "statDistribution": {
      "$ref": "https://schemas.mu46.local/v1/stat-distribution.schema.json"
    }
  },
  "$defs": {
    "id": {
      "type": "string",
      "pattern": "^[a-z0-9]+(?:-[a-z0-9]+)*$"
    },
    "semver": {
      "type": "string",
      "pattern": "^(0|[1-9][0-9]*)\\.(0|[1-9][0-9]*)\\.(0|[1-9][0-9]*)$"
    },
    "nonNegativeInt64": {
      "type": "integer",
      "minimum": 0,
      "maximum": 9223372036854775807
    },
    "resetInputs": {
      "type": "object",
      "additionalProperties": false,
      "required": ["resetCount", "pointsPerReset"],
      "properties": {
        "resetCount": { "$ref": "#/$defs/nonNegativeInt64" },
        "pointsPerReset": { "$ref": "#/$defs/nonNegativeInt64" }
      }
    },
    "versionedRef": {
      "type": "object",
      "additionalProperties": false,
      "required": ["id", "version"],
      "properties": {
        "id": { "$ref": "#/$defs/id" },
        "version": { "$ref": "#/$defs/semver" }
      }
    },
    "equipmentEntry": {
      "type": "object",
      "additionalProperties": false,
      "required": ["itemId", "itemVersion", "level"],
      "properties": {
        "itemId": { "$ref": "#/$defs/id" },
        "itemVersion": { "$ref": "#/$defs/semver" },
        "level": { "type": "integer", "minimum": 0 },
        "optionLevel": { "type": "integer", "minimum": 0, "default": 0 }
      }
    }
  }
}
