{
  "schemaVersion": "1.3.0",
  "id": "build-draft-synthetic",
  "ruleset": {
    "id": "ruleset-synthetic",
    "version": "1.0.0"
  },
  "dataset": {
    "version": "synthetic-001",
    "hash": "sha256:0000000000000000000000000000000000000000000000000000000000000000"
  },
  "engineVersion": "0.1.0",
  "progressionInputs": {
    "characterClassId": "class-synthetic",
    "evolutionId": "evolution-synthetic",
    "level": 3,
    "completedQuestIds": []
  },
  "resetInputs": {
    "resetCount": 2,
    "pointsPerReset": 100
  },
  "equipment": [
    {
      "itemId": "item-synthetic",
      "itemVersion": "1.0.0",
      "level": 0,
      "optionLevel": 2
    }
  ],
  "statDistribution": {
    "schemaVersion": "1.1.0",
    "rulesetId": "ruleset-synthetic",
    "characterClassId": "class-synthetic",
    "progressionRule": {
      "id": "progression-synthetic",
      "version": "1.0.0"
    },
    "earnedPoints": 10,
    "resetInputs": {
      "resetCount": 2,
      "pointsPerReset": 100
    },
    "resetPoints": 200,
    "totalDistributablePoints": 210,
    "allocations": {
      "stat-alpha": 4,
      "stat-beta": 3
    },
    "spentPoints": 7,
    "remainingPoints": 203
  }
}